"SP2_ball_received_T","dv1_OE_game_satisfaction","dv1_oe_playtime_satisfaction","dv1_oe_earnings_satisfaction","dv1_oe_treasurer_behavior","dv1_oe_sp2_behavior","dv1_oe_message_to_treasurer","exp_condition"
"8","Yes it seemed like a very fair game of passing a ball and in the end both players earned the exact same amount of points. The treasurer passed the ball to both players and most times this was done in turns from one to the other player ensuring equality throughout","Yes I am satisfied with how much I got to play. It seemed at most times that the treasurer was passing the ball and alternating the player he or she threw the ball to. I felt like i receved the ball the same amount of times as player no 2.","yes i am very satisfied with the amount of money I made in this game as it was the same amount of money that player no 2 also made in the game. As a result this seems like the best and most fair outcome we both could have hoped for","I feel that during the game that the treasurer behaved fairly to both player 2 and myself as player 1. The treasurer consistently alternated between tossing the ball to myself and player number 2. This met my expectations and it was a fair outcome so I don't wish he or she behaved differently","During the game player no 2 did not pass the ball to me but I also didn't pass the ball to player no 2. So we behaved the same as each other which I think is fair as we were both aiming to earn as many points as possible in the task","If I could speak to the Treasurer and describe my reactions then I would say that they played well and kept it fair throughout the game and passed the pass equally between myself and player number 2. I would thank them for the way they played and treated each player equally",1
"8","I think the game seemed quite fair, although did feel quite long at certain points, and I wasn't sure where the ball was going to go. I got the same amount of coins as SP2 so it did feel fair, and got the same outcome too as they did so all good.","Yes I was satisfied, it was a direct split in how often I and SP2 got the ball so it seemed fair. The order was quite sporadic so wasn't sure if it would be fair but overall it was super equal and fair. We both got rewarded equally which was great.","Yes I am. I think the bonus was a great addition for not much work and always nice to have a little extra on top of challenges. Nice that both me and someone else got a fair bonus but of course wouldn't have minded if I had got the chance to get some more coins.","I think they were incredibly fair, and split the allocation of the ball throwing to each player perfectly equally, and gave us both an equal chance to return the ball to the treasurer and earn the coin for doing so as part of the challenge. I did think the treasurer would give to the opponent more but I was surprised they didn't.","I think SP2 played the game in the exact same way as I did. I would hope if given the choice, they wouldn't have surrendered some of their coins for me to lose mine as they would also miss out. They didn't throw to me and miss out on any coins, but neither or wouldn't I.","I would question if they were keeping track of how many times the ball was passed to each player, as it was perfectly fair and if it was I would thank them for doing so which meant that SP2 and I both got equal opportunity to get the coin bonus.",1
"8","I do feel satisfied with the way the game had went, as i believe the treasurer was being fair throughout the game, by giving equal amounts of throws to both myself and SP2. I feel as though it was the right decision therefore, not to reduce my counterparts earnings in the second part of the task.","I am very satisfied with how much i got to play the game. I had initially thought that i would be excluded from the game and wouldnt get many chances to play, but the treasurer was fair throughout the game and had given equal amounts of throws to both myself and the second player","I am satisfied with the amount i made. I would of liked to have made more, but i cannot complain as my counterpart had made the same amount. For the sake of sportsmanship and fairness, this is the reason i decided not to reduce the amount my partner had made, as well as reducing my own amount of earnings.","I did like the way that the treasurer played in the game. I thought that they showed fairness and integrity by giving equal amounts of throws and opportunities to both of the players of the game. I was a little skeptical at the start that they would play the game this way, but was glad that they did so.","I wouldnt say that I disliked the way SP2 played, as i had played the same way. Knowing that no money can be made by passing the ball to myself and visa versa, made it clear that the only clear and sensible decision for them, and for when it was also my turn, was to pass the ball back to the treasurer.","I would say thank you for playing the game with fairness and allowing both players to have an equal amount of time and opportunity to pass the ball back to them and make the same amount of bonus each. I think it was a great way to conduct themselves throughout the game.",1
"8","No, because there was no situation in which I could win, the treasurer made it so basically they chose which person would win, because it was up to them which way the ball was thrown. there was no scenario in which I could have influenced my win, it was based solely on luck","No, because I didn't get any ability to influence the chances in which I would gain more points, the wins would only be determined on what the treasurer decided. I didnt get to click unless the treasurer tossed the ball to me, so the engagement was not very exciting at all.","No, because there was nothing i could to to impact the outcome unless it meant not giving as much money to someone who earned the same amount of points as i did. it didn't make it fair to decide that I earned more for no apparent reason. the gameplay doesnt make sense","No, because it felt very stagnant. it was thrown at me, i throw back, thrown at sp2, thrown back. there was no different outcome except when they tossed it back to me. we ended with  the same amount of points. it would be much more enjoyable if it was more random. ","They reacted just as much as I did. There was nothing they or i could to to impact the outcome of this game, unless i costed myself points. they ever passed it to me and i never passed it to them. it doesnt make sense and nothing they could have done would have hellped them win","I would tell them to make it more random who they threw it at. Theres absolutely no guessing with the way they did things. The game was boring because i could predict a pattern, and it almost seemed like they intentionally made it a tie. It would be more enjoyable if it was random",1
"12","i was frustrated as the ball rarely passed to me so could not earn as many points, i was bored just sitting there watching the others play waiting for me to be able to join in the game, i wish i had better options to be able to join in more","not satisfied as i did not have a fair share of the passes, the treasurer and player 2 mainly just passed the ball to one another whilst i was left watching and hoping i would be able to join in and earn a few points as well, very frustrating to be honest","fairly happy as it all counts but more would have been better, if i could have made the same as player 2 i would have felt much happier though, it did not feel very fair and although happy i got the ball a few times more would have been better","i thought it was a little one sided and favoured player 2 more , they could have been fairer and passed the ball more equally between the 2 players as they was not getting points so it did not matter to them who he passed the ball too, was not a good game player","they just did what they could to earn themselves the most money available to them so understand their actions but still think they could have shared the ball more so everyone got a fairer shot of the points available, they was being a little selfish but do understand why they would do that","i would tell them to be fairer and give both players the same chances, they chose to help one player more than the other one so was quite biased i think,they needed to help everyone by passing the ball equally between the 2 players, it made me feel a little rejected ",3
"12","I was rather unsatisfied with how the game progressed as I did not get the ball passed to me as much as the other player. From the beginning it started I noticed that there is nothing stopping the treasurer from favouring one player over the other which made it bias.","I am quite unsatisfied as it seemed like the treasurer was deliberately excluding me from the playing session and favouring the other player for some unknown reason which was rather frustrating. It almost seemed like they were in kahoots and knew eachother outside of this game somehow which is unlikely.","No as I made less than half of what the second player made and it was not equally distributed at all. I dislike the fact that there was nothing I could do and absolutely no strategy involved in the game. I even checked to see if I could throw to player 2 again.","If I was in the treasurer's position I would've made an effort to pass the ball to each player equally however this treasurer was extremely bias and only passed to player 2 which I disliked. I felt as if I had been disrespected and not taken seriously by the treasurer.","Interestingly, I did harbour some dislike of the second player during the game but after recollection I realise they also had no control over the games outcome so I do not have anything against them. However, it is unclear if they had different rules to me which could be possible.","I would say that I am annoyed that they were so bias playing this game and ask them why they favoured throwing the ball to the second player. I do not appreciate your actions but also would like to know if you earn't any money somehow, perhaps you had different rules.",2
"2","yes, i am as I got a lot more points then expected. It was lot easier than expected but would've loved to know more details in order to get more points to meet my target. It was satisfying as i surpassing SP2 by quite a large margin. i am thoroughly satisfied","no. i would've liked to play more. I was not given enough time in order to surpass my score, as i know having another chance would've allowed me to better the results and for me to improve a lot more. It was well explained but not well interperted on my part.","Yes, as that was the best outcome i could get. Since both parties benefited, it was quite satisfying to know that we both left with portions that reflected the results i got in the game. I would've wanted more but when both players benefit then that becomes a way better outcome","it was played quite fairly so yes i am. i could have done better though and i wish i could've played faster. The treasurer did however give me a bit of doubt as i wanted to get a lot more bigger results, so he behaved fairly but not in a way i expected ","played to the best of their ability, not really as expected and i wouldn't have done anything better. By knowing their initial thought process and patterns, it would have been a lot easier to understand their behaviour and move accordingly, so i could be more satisfied with reacting SP2 to the game","I would've wanted a little more collaboration and advice. By understanding the treasurers thought process and understanding his body language in order to move accordingly. By having a better understanding of the treasure and reading his patterns then it would have been a lot more easier yo react the right way",1
"8","Satisfied because I got all the points possible.  I could have done no better.  The game was rigged so it was impossible to screw up.  It was kinda dull though.  I mean I couldn't drop the ball or miss with the throw and the same wasa true for the other guy.","It was a little tedious so if the game ended earlier it would not have bothered me.  I was given the ball the same amount of times as the other guy so no complaints there, it was a fair distribution.  It would have be better tohave a bit of variation, a way to steal the ball or drop it","It's a pittance.  So in that sense dissatisfied.  But according to the rules of the game it was the maximum I was allowed to win so in that way it was satisfactory.  But I wouldn't normally cross the street for 40 cents.  I'd need at least a dollar to do that.","The treasurer acted in a very fair and equitable manner.  He and or she distributed the ball equally to my self and to the other guy.  The so called treasurer made sure we each came away with maximum payments.  But while fair, he was eminentaly predicable and therfore a boring actor.","SP2 was just an automoton.  Or if he or she wasn't, if he or she was in fact human, they behaved exactly as expected.  After all, they were given no choice.  They couldn't throw the ball to me for instance just to break the monotony.  They nad no choice at all.","I would say, 'Hey, buddy, can you mix it up a bit?  You know, throw underhanded or overhanded or lob it and toss a fast ball or something.  Do something to add some element of doubt to the game, make it harder for me or the other guy to catch the ball.  Or maybe sometime throw a rock which we had to duck instead of catch.""",1
"12","It would have been nicer to have received the ball a few more times - it could have been a bit fairer that way. The game would have been far more interesting both to watch and also to participate in. It would have been a better all-round game for everyone. ","As I mentioned above, in many ways, I think I could have been throw the ball quite a few more times so it matched the number of times Player 2 received the ball. If this had been a bit closer, the match would have been more interactive and engaging for all involved.","Yes, it's not too bad. I think the rewards should have been more even though! The money wasn't the main aspect. I think the participation in the game and overall effort to understand the rules meant that both players are geared up to play so the money wasn't the main aspect.","I wish they behaved in a more just and fair way. It would have been a better game as much of the time I was just watching the game as an observer. The behaviour was fine as I received some of the throws but this would have been more engaging for everyone if the Treasurer had acted differently. ","They were absolutely fine in my opinion. I don't really think they did that much wrong! They played the game in the best possible way, which made sense to increase their winnings as much as possible. They did pretty well and made the right choices in terms of who to throw to.","I would just say that it would have been way more fun to have played a bit more and received the ball more times. This would have made sure that everyone had a fair chance of participating in the game. It would have been more interesting on a whole with everyone equally involved.",3
"8","I think the game went well . I am satisfied with it . I was actually glad that it seemed like I received the ball an equal amount of time from the treasure compared to player 2. I also like that Player 2 also tossed me the ball and did not just pass it to the treasure.","I am not completely satisfied with how much I got to play. I feel like my gameplay time could have been longer . Maybe they could have included a timer that let me know how much time I got to pay instead of just cutting me off at a point, cold turkey","I wish I could have made more money ,but I have to say that I am overall satisfied with the money I made. I essentially earned money while getting to play a fun game and I actually did not remember that I was earning money at a certain point, just remembered to pass ball to treasurer.","I think that the treasurer had fair behavior during the game. I like how it behaved and seemed to pass the ball equally to me and the other player. It exceeded my expectations because I thought it was going to be biased on passing the ball to only player 2.","I liked how player 2 acted during the game. It exceeded my expectations. I thought that player 2 was only going to pass ball to the treasurer. I wish they would have passed me the ball more often than they did so I could make a lot more money than them.","I would tell the treasurer that their choices during the game seemed very balanced and fair to everyone involved. It looked like the ball was passed to both players an equal number of times throughout the session. This made the game feel consistent because I always knew I would get another turn soon.",4
"8","The game went fine.  We both received the ball an even amount of times.  We each threw the ball to the treasurer 8 times.  Nothing surprising happened.  I don't have strong feelings about how the game went.  it went as expected.  I think everything was done fairly.  No big deal.","I am satisfied by how much I got to play.  The playing time was split evenly.  I guess the treasurer got to play more than the standard players, but that was fine.  I wouldn't have minded if the game went a little faster.  It was a little slower than I expected.","Yes, I am satisfied with the bonus.  Both myself and SP2 received the same amount, so that seems completely fair.  I would have played longer for more money, but it wasn't a choice.  I am always pretty happy with any bonus in addition to the basic sum I make for playing a game.","Treasurer played fairly.  They tossed the ball to both players an equal amount of time.  There might have been once where the treasurer threw the ball to SP2 twice in a row, but we each ended up with the same amount of points so it all evened out.  It was all good.","I think SP2 behaved like I would expect.  Each time they received the ball, they threw it back to the treasurer, just like I did. It wouldn't help them to do anything else.  And since the treasurer was basically taking turns throwing us the ball, I didn't expect SP2 to throw it to me to make things even.","I would tell them that I thought they were objective in how they played the game.  They tossed the ball evenly to both of the other players, so it wasn't like they played favorites.  I appreciated that they didn't try to make one person upset and the other person happy.",1
"8","I believe the game was fair as the other player and I received the same amount of points overall and there was no favouritism. The game was also very simple, easy to understand and progressing through was easy. I did wonder how many turns the game would go on for as there wasn't any information on that.","Yes, as I had gotten the same amount as the other player and did not have to wait long times to get the ball or witness multiple throws between the treasurer and sp2 without having a go. The game was well paced and I did not have to wait long periods.","Yes, as I believe the task was very simple therefore a significant amount is not to be awarded so was not expecting a lot in the first place anyway. The amount of money was fair compared to the amount of time spent on the task and compared to how much sp2 earnt.","The treasurer behaved fairly during the game and did meet my expectations in terms of fairness in play. I do not think anything should have been done differently and was in fact expecting most of the throws to be given to sp2 after seeing the player get the ball first.","Sp2 met my expectations as they listened to the instructions and only threw it to the treasurer so they could gain points as if they had thrown it to me it would have caused them not to earn points and it would have been a wasted throw for both players. I did think they may pass the ball to me if there were many turns.","I would say thank you for being fair to both players and giving the same amount of throws and opportunity to earn the same bonus. Their fairness in throwing the ball meant I did not have to step in and pass the ball to sp2 to ensure they could earn the same and therefore the treasurer's behaviour caused for there not to be wasted throws between players.",1
"8","I am satisfied with how the game went for me. The instructions before the game were clear and understandable, so it made the game easy to play and win. The rules were fair for each player and there were no deviations from the rules of the game, which avoided any confusion.","I am satisfied with the number of times I got to play. The game can be too repetitive if played for many rounds. So the small amount I played, I enjoyed the game. I would play it again if the opportunity arose, but maybe with more players and moving parts.","I am satified with the money I made from the game. It is a simple game, I was not expecting to be paid much. When I play a game, I play for entertainment so I do not ever expect to be paid to play a game, so I am very satisfied that I got money for playing a game.","At first, the treasurer's behavior was confusing to me, as they were passing the ball to SP2 more times than me. After a while, I saw they were playing fair in the number of times the ball was passed to each player. There is not much the treasurer could have done differently without being unfair.","SP2 played the game as it was intended, so I was not surprised. In fact, I appreciate that SP2 understood the rules and played fairly. They behaved well and resfectfully by following the rules pf the game and not trying to cheat the gamr. I definetly met my expectations while playing the game.","I am very satisfied with how they handled the game and how fair it was to me and SP2. They made playing the game satisfying for me with the fair amount of times the ball was played to both players. There was no cheating or favouritism which is honourable quality.",1
"12","not at all because i didn't get enough opportunities like the other player did because the treasurer intentionally threw the ball to the other player player way more times than he threw to me so that was obviously very unfair and seems very intentional and not just a accident or just a chance of it happening","i wasn't satisfied at all because again i didn't get enough opportunities like the other player because the treasurer threw to the other players way more times than he threw to me so that was obviously very unfair and seems very intentional and not just a accident or just a chance of it happening","it depends on if they give me the 0.10 cents but if not then yeah I'm not satisfied at all because again i didn't get enough opportunities like the other player because the treasurer threw to the other players way more times than he threw to me so that was obviously very unfair and seems very intentional and not just a accident or just a chance of it happening","i disliked his behavior because he intentionally threw to the other player more so he didn't even try to make it fair he know what he did was obviously very unfair and was very intentional on his part and not just a random accident that he make a excuse for ","he didn't do anything wrong he was just playing the game and didn't make the rules or choose how often he get thrown to it was all on the treasurer for intentionally throwing to him making it obviously very unfair and was very intentional on his part which ruin the game","He probably wouldn't care because he intentionally made it unfair from the beginning because he knew the rules and what he was suppose to do but instead he intentionally threw the ball to one player the whole time making it obviously very unfair and was very intentional on his part which ruin the game",3
"12","I was not satisfied with with how the game was being played because the treasurer and sp2  were passing the same to each then me I felt I was ignored and not part of the game which i feel was extremely unfair and game wasn't played fairly at all .","I most definitely was not pleased with the amount I made compared to the other people I hardly had the ball come over to my side to even play the game it just felt was a person watching the game being played and not included I was not satisfied with the play time i got ","No I am not pleased with the amount I made because I feel if the game was played more fairly both players bonus's would have been similar and not 4 for me and 12 for the other people which is totally unfair I barely made any bonus at all times","The way the treasurer behaved during the game was not right I didn't feel I was treated right and disliked his behaviour towards me it most definitely did not meet my expectations in any sense and it definitely didn't meet my expectations and I don't see what I could have done differently if the ball wasn't passed to me much","SP2 behaviour during the game wouldn't have made no difference to me as the ball was meant to be passed from the treasurer sp2 behaved the way a player would when playing a game for a good bonus amount i don't feel i could have done anything differently during the game ","If I could speak to the treasurer I would ask why the game wasn't played fairly what reasons did you have to not pass me the ball the same way the ball was passed to sp2 more why was this decision made that way and what was there thought process ",2
