"SP2_ball_received_T","dv1_OE_game_satisfaction","dv1_oe_playtime_satisfaction","dv1_oe_earnings_satisfaction","dv1_oe_treasurer_behavior","dv1_oe_sp2_behavior","dv1_oe_message_to_treasurer","exp_condition"
"12","No, I was given the ball much less than the other player, so most of the time I was just watching the game instead of actively particpating in it. I thought the treasurer should've been more equal and thrown the ball alternatively between myself and player two. This would've been more fair.","No, I only got to throw the ball 4 times, so I had much less participation than the other player. I would've been more satisfied with the game if the throws were equal between both the players, with obviously the treasurer getting more of the ball overall. The main fault ","Not really, the other player got three times more than me initially, so I wasn't all that satisfied at the end of it. I am satisfied that I got to adjust the amounts though, as I ended up making it equal between myself and the other player, which is more fair all things considered.","I disliked how the treasurer behaved. I believe they should've thrown the ball an equal amount of times between myself and player 2, this would've been fair and just for a game like this. They were always going to receive more of the ball compared to both players, so there was no reason to make it unequal.","I feel they played the game in a normal way. They constantly threw the ball back to the treasurer when they received the ball, which is what I would've done. They perhaps could've thrown the ball to me once they knew it was getting vastly unequal, but overall they played the game to get the most points for themselves.","I'd say: You were quite unfair with the distibution of throws between myself and the other player. It didn't benefit you to throw the ball to a player more than the other, so you should've been more equal and balanced. You should put yourself in a player's shoes and think what you would want and act accordingly.",3
"6","no, there was clear bias in the way the treasurer threw the ball. It was annoying to be constantly ignored during the game, it was like I wasn't there. I tried throwing to SP2 but he just threw it to the treasurer. I came away with the feeling that the game was not fair.","No, I got the ball 4 times and the other player got it many times more. I think I should have had an equal number of goes. It does not seem fair that there was such a great disparity in the number of turns each player got to take part in the game.","No, because I did not get equal opportunity. I should have been given the chance to throw to the treasurer equally with SP2. If I was given an equal chance I could have no complaint, but as it turned out I was never going to earn as much as the other player.","The treasurer behaved with clear favouritism. He threw the ball to the other player far more than he threw it to me. I would like to know why that is, or if there was something I could have done differently or tried to influence the treasurer, but both options I tried didn't work for me.","
they were very predictable, throwing to the treasurer every time. to be honest i would have done the same thing. i did try throwing it to SP2 twice but it didn't change the outcome for me. The treasurer clearly favoured them as they go many more turs than me, which was unfair.","why where you not equal and fair? Could I have done anything to change or influence who you threw the ball too? why give me the option of throwing to the other player when it made no difference to the game or outcome? I would have a lot to ask.",3
"12","No, I'm quite annoyed as I don't think it was fair, it was quite one sided in my view. I was not given a fair chance to earn a bonus. The treasurer just kept passing the ball to player two. Triple the times it was passed to me. Really annoyed.  ","No, player two was allowed to earn much more, there was no fair opportunity here. Player two was able to earn triple the amount I earned, I don't think that there was any fairness in that. Its not Player two's fault, but more the treasurers. I blame the treasurer as they should be mutual. if they can't then they should not be the treasurer. ","Not at all, $0.10 is nothing, and you can't do anything with it, you might as well donate it. As I mentioned earlier, there was no fair opportunity to earn a bonus here, which I was quite looking forward to, I really wanted to earn something meaningful. It's a damn right shame. ","It did not meet my expectations and it was quite one sided. I am really disappointed in the treasurer, I think they should have been mutual and given a fair chance to both players to earn the bonus. I'm just really disappointed by their behaviour in the game, no fair opportunity at all.  ","I feel really guilty no for reducing their bonus when you ask me this, in truth, its not their fault, but I was just felt really annoyed. It is the treasurer fault for not being fair in the game. I punished an innocent person by taking away their bonus. Not good on my part. ","I would have told them straight, this is very one sided and you have been Biased, I was left out and not given any opportunity to earn a bonus. You should have been mutual, you have been given the power to decide who earns what. Really disappointing indeed. You should be ashamed. ",2
"12","I think the other player won more, but I am fine with how the game went overall. I did not changing our amount we took in a bonus really mattered. This is why I chose not to change what we both individually were given in the game in bonus money.","I was somewhat satisfied with how much I got to play. Obviously the other player was given more opportunities to throw the ball resulting in more bonus money for them. However I felt the overall game was the correct length of time, not to long and it was also not too short.","I am overall satisfied with the amount I made. The bonus would not have added up to much anyways, so I did not care that much about the bonus money. However, it obviously would have been better if it was fair and even between the two of us as players.","I felt the treasurer strongly preferred the second player. I of course thought the treasurer would have been more even. The thing I wish they would have done differently is throw the ball an even amount of times between me and the other player for the duration of the whole game.","I think the player SP2 was only responsible for themselves. They did not get to choose how many times the ball was thrown to them. They were obviously not able to throw it to me, so I do not think they can be blamed for the uneven throwing of the ball.","I would ask the treasurer why they favored player 2 over me. I would also like to ask them if they knew about the bonus and that this could monetarily affect me. I finally would want to know if they realized they had thrown the ball to player 2 so many times.",2
"8","I am satisfied, we both got the same point. But the treasurer was not fair during the game, The treasurer passed the ball to SP2 more often which could have made me earn less. But SP2 passed the ball to me a couple of time to make up for the treasurer's shortcomings.","No, I want to play more to earn more points. The game was fun and I would have gotten more points if given more time to play. I enjoyed the game because because it was very simple to understand and also very simple to play. I am not satisfied with how much I got to play.","No, I want to earn more but the game ended too soon. I want to make more money from the game because the game is very simple to understand and also very simple to play. It requires very little mental effort to play the game. I am not satisfied with how much money I made.","No, the treasurer favored SP2 during the game and passed the ball to SP2 more often. I do not like how the treasurer behaved during the game because the treasurer could be fair to both of us. The treasurer did not meet my expectation. The treasurer should do better next time.","Yes, SP2 passed the ball to me a couple of time, even though I did not pass the ball to them. SP2 surpassed my expectations because they could have passed the ball to the treasurer to earn more point. I did not expect that. I like how they behaved during the game.","I would say that the treasurer was not fair during the game. I would tell the treasurer to do better next time and be fair to both players. I would tell the treasurer that I could have earned  more that 8 points if they passed the ball to me more.",4
"11","I am satisfied on how the game went. This is because there was a fair play in the game between both players and the treasurer. Also, SP1 was also very gracious to throw some ball to me in order for me to earn more points in the game. Overall, it was a really good game and I am satisfied with the outcome.","I am satisfied with how much I got from the game. The game was a straight forward game without much complexity. It is a game that is easy to play and so I think the pay for the play was good. Also the game was not very long and this also increased my satisfaction.","I am satisfied with how much money I made. This is given to the fact that the play was not complex but an easy one and I did not have to spend much time on the play. I am satisfied with how much I was able to make in that short period of time.","I think the treasurer played out the instructions they were given. I do not really like the way they behaved. This is because, they threw more ball to SP2 more than they did me SP1. I expected a fair behavior by making sure the ball was thrown evenly without favoring any player. I wish they were impartial with their throws.","The behavior of SP2 was really commendable during the play. I like how they behaved and this is due to the fact that they considered SP1 and threw balls to them so they can also ern points. Such behavior exceed my expectation and there is also nothing I wished they would have done differently.","If I could speak to the treasure describing my reactions to how they played was played, I would express my dissatisfaction and frown at their behavior. I would point out the need to be fair and impartial and not favor a particular player over another in such games, I would also explain how it affected me in the game. ",4
"8","At first I was going to pass the ball to the other player when needed so we made same the amount of money. There was a few rounds he went ahead of me by 2, I never dropped below him but would of passed it to him when and needed.","Yes I was happy with how much I got to play, maybe a few more rounds would of been great. Maybe even a way to communicate with the other player would of been nice. Apart from all that it was a positive fun game. Not much else to say on this one.","As with anything like this in life, we would of liked to earn more money of course. But saying that me and the other player did split all 16 rounds between 2 of us so getting 50% of the bonus pool was suffiencet enough for me to be positive in this game.","The tresuer was ok in his responses, i noticed he threw the ball more times to the other player, this might be because he recieved the ball a lot more from player 2. It would of been great if he had thrown it to me a few more times though.","Player 2 was fair in the end, was a few rounds he went ahead by 2 on the bonus points, I was feeling abit annoyed by this and was hoping he wouldn't try and steal all the points. But in the end everything was sorted out and we both got half the bonus pot.","I would say I felt a bit annoyed at times for not throwing me the ball, and throwing it more to the other player. Then again the treasurer can decide who to throw it too. Maybe he wanted player 2 to earn more bonus points that me? Who knows apart from him,",4
"12","No it felt really unfair as the treasurer kept passing the ball to SP2 and hardly ever to me. SP2 got the ball 3 times as much and never once passed the ball to me it felt completely unfair. I did think if maybe I had passed the ball to SP2 would they have passed it to me?","No I only got to play 33% compared to SP2 who got 66% more balls than I did so it felt really unfair. I felt like a spare part just watching the treasurer pass the ball to SP2 all the time. It did seem like they were favoured a lot more.","I mean I made something which was OK I suppose but it was low in comparison to what SP2 made so it did feel that the treasurer was heavily biased towards sp2. It would have been nice to get a fairer shot at getting the ball thrown to me a but more.","No I thought they clearly favoured SP2 a lot more as I have previously mentioned they only actually through the ball to me 4 times, where as they threw the ball to sp2 a total of 12 times. It felt like they favoured SP2 and I was just there like a spare part.","Well I can't really blame them as they may have been instructed to do the same and only throw the ball to the treasurer however they could have maybe passed it me a couple of times, I don't know if I would have done the same thing had I been in their shoes","Hey why aren't you passing the ball to me a bit more. This is completely unfair as you are only passing to me a third of the time and are being a lot more favourable to SP2. I felt stupid just waiting for the ball which hardly ever came to me.",3
"12","I am not satisfied with how the game went. It started with even passes among all players, but soon the Treasurer and SP2 passed mostly between themselves. This left me with few chances to receive or throw the ball. My points stayed low as a result, despite waiting for balance to return.","No, I am not satisfied with how much I got to play. At the beginning, I received the ball several times, but later I was often left out. The Treasurer threw to SP2 repeatedly, and SP2 passed back to them, sidelining me for long periods. I wanted more consistent involvement throughout.","I am not satisfied with how much money I made at all. I earned $0.20 from limited throws to the Treasurer, while SP2 got $0.60. The scoreboard showed the gap grow after initial play. Equal chances would have meant higher earnings for me, but exclusion kept mine low. It was not fair at all.","The Treasurer passed mostly to SP2 after early rounds, very rarely to me. This did not meet my expectation of fair distribution of the ball. I wish they had alternated throws more, including me regularly to keep all involved, instead of creating a loop with SP2 that limited my participation.","SP2 passed back to the Treasurer almost every time after the start, leaving me out. This differed from my expectation of shared passes. I wish that they had thrown to me at least occasionally, allowing more turns and points, rather than consistently favouring the Treasurer and reducing my chance of opportunities.","You passed to SP2 most of the time after the beginning, so I rarely got the ball. This kept my points low at $0.20 while yours and SP2's rose. I expected more balance, but the pattern left me out. Throwing to me more would have evened participation and been fair.",3
"8","I SUPPOSE SO, YOUR RULE PAGE WAS WRONG ANYWAY SO IT'S NOT LIKE IT MADE SENSE YET? BUT, I WOULD BE VERY VERY VERY VERY VERY HAPPY TO PLAY THE GAME AGAIN AS I WON AND THOUGHT THAT IN THE END IT'S ALL ABOUT THE BIGGEST WIN POSSIBLE ...... LOSERS","YE, ITS BETTER THAN NOTHING, IT WON'T BREAK THE BANK WILL IT AND I GOT MORE THAN PLAYER 2. BUT, I WOULD BE VERY VERY VERY VERY VERY HAPPY TO PLAY THE GAME AGAIN AS I WON AND THOUGHT THAT IN THE END IT'S ALL ABOUT THE BIGGEST WIN POSSIBLE ...... LOSERS","YES I GOT A FAIR SHARE OF THE ACTION, THAT IS IF YOUR ARE ASKING,  CAN EARN SOME MORE? BUT, I WOULD BE VERY VERY VERY VERY VERY HAPPY TO PLAY THE GAME AGAIN AS I WON AND THOUGHT THAT IN THE END IT'S ALL ABOUT THE BIGGEST WIN POSSIBLE ...... LOSERS","I HAD NO EXPECTATIONS AFYER ANSWERING THE QUIZ INCORRECTLY ON PURPOSE TO ACCESS THE GAME SO JUST RANDOM I SUPPOSE? BUT, I WOULD BE VERY VERY VERY VERY VERY HAPPY TO PLAY THE GAME AGAIN AS I WON AND THOUGHT THAT IN THE END IT'S ALL ABOUT THE BIGGEST WIN POSSIBLE ...... LOSERS","I HAVE NO REAL THOUGHTS REGARDING PLAYER 2 I THINK THEY WERE CALLED?  THE OTHER PLAYER, ANYWAY, AS I FELT IT WAS RANDOM. BUT, I WOULD BE VERY VERY VERY VERY VERY HAPPY TO PLAY THE GAME AGAIN AS I WON AND THOUGHT THAT IN THE END IT'S ALL ABOUT THE BIGGEST WIN POSSIBLE ...... LOSERS","NICE ONE, THANKS, THROW ME A FEW EXTRA BALLS NEXT TIME ;) I THOUGHT THE WAY YOU PLAYED WAS ACCEPTABLE MT TREASURER. BUT, I WOULD BE VERY VERY VERY VERY VERY HAPPY TO PLAY THE GAME AGAIN AS I WON AND THOUGHT THAT IN THE END IT'S ALL ABOUT THE BIGGEST WIN POSSIBLE ...... LOSERS",1
"12","I am not satisfied with how the game went for me. The bias was very much towards the other player. This meant that I did not get much of a chance to play. Apart from lacking the chance to earn anything, it was boring just watching and waiting for the ball to come to me.","I am not satisfied with how much I got to play in the game. Again, the bias was towards the other player. I spent most of the time waiting for a turn to throw the ball myself, so did not get to take much part in the game at all.","No, I am not satisfied with how much money I got to make in the game. I got a lot less money than the other player got to make. I also had no chance at all to influence how much I could earn, which made it even less satisfying to play.","The treasurer was very biased towards the other player, hardly ever throwing it to me to give me a chance to earn as well. I disliked the behaviour as I was largely excluded. I expected the throws to be more equally distributed, which is what I would have liked done differently.","The other player's behaviour met my expectations: they played according to the rules, and the treasurer's bias benefited them. I didn't dislike their behaviour, just the outcome. I would have liked them to break the rules and throw to me now and then to give me a chance to catch up.","I would tell the treasurer that I felt very excluded from the game, and that I was bored throughout. I'd add that it felt a very unfair and pointless waste of time for me. I would also ask why there was so much bias to the other player and what was supposed to be fun about it.",2
"12","I found it a bit frustrating as the treasurer kept passing it to the other player which meant I didn't get many points at all. It felt like the treasurer was favouriting the other player more by throwing the ball to them more often than throwing to me which was annoying.","No I felt that I didn't get a fair chance at playing as the treasurer just kept throwing to the other player which meant I didn't get a chance to get many points. The other player received the ball lots more times than me which meant they were able to receive more points.","Not really as I didn't make very much at all. The ball was only thrown to me twice which meant I could only throw it back to the treasurer and receive some money on two occasions whereas the other play received it many more times than I did. I didn't make much money.","I didn't like how they behaved. It felt like the other player was being treated as the favourite and I wasn't being treated fairly. The other player received the ball lots more times than I did and therefore they were able to get more points and make more money than me.","I feel quite neutral about player 2 as they weren't able to throw the ball to me anyway. I felt annoyed that they kept getting the ball and therefore getting points but this wasn't their fault, it was the treasurer's fault. I didn't feel annoyed with player 2 as it wasn't their choice.","I would say that it made me annoyed and I felt that the game wasn't being played fairly. Player 2 received the ball many more times than me which meant they were able to make more money than me. The treasurer should have played more fairly, allowing us both to get the ball the same number of times.",2
"11","No. The ball was passed to me fewer times than to the other player, which limited my involvement. Because of that, I had fewer chances to participate and influence the outcome. The uneven distribution made the experience feel unbalanced and reduced my overall engagement with the task. If the ball had been passed to me more I would be satisfied","No. My opportunities to receive and pass the ball were limited compared to the other participant. This reduced my ability to take part in the activity in a meaningful way. I would have preferred a more equal number of turns so that participation felt more evenly distributed. I would have liked to play longer","No. My total earnings were lower than the other participant’s, which reflected the limited number of opportunities I had during the game. Since earnings were tied to participation, the imbalance in ball distribution directly influenced the final outcome and reduced my potential gain. I feel like the game should of been longer","The Treasurer appeared to direct the ball more often to the other participant. This created an uneven pattern of interaction that shaped the overall flow of the game. I would have preferred a more balanced approach, where passes were distributed more equally among both players. They should have given me the ball more","SP2’s behavior seemed consistent with the structure of the game. They responded when they received the ball and continued the sequence of passes. Since the Treasurer appeared to control much of the distribution, SP2’s actions did not stand out as unusual or unexpected. They had no say in the game","I would ask why the passes were directed more frequently to the other participant and whether there was a specific reason for that choice. I would also mention that a more balanced distribution could have created a more equal experience for everyone involved. I tell them to be fairer in future",2
"12","The Treasurer did not throw me the ball nearly as many times as they threw it to the second player. It would've been more satisfying if we had received the ball an equal number of times. I slightly regret my choice to always throw the ball back to the Treasurer, because maybe if I had thrown it to the second player they would have engaged with me by throwing me the ball as well.","I am not satisified with how much I got to play, because the second player got to play 3x as much as I did. It would have been more enjoyable and satisfying to be more engaged in the game, with equal partcipation and receiving of the ball. It was still an interesting game.","I am okay with the amount of money I made; I would say that I am reasonably satisfied because it was still interesting to engage with the game even though SP2 made quite a bit more additional money than I did. The fact that he made more money did not decrease my satisfacation overall.","It appears that the treasurer favoured throwing the ball to SP2, which was somewhat confusing and perplexing to try and understand his motives for choosing to go back and forth with SP2 rather than spend more time throwing me the ball as well. I don't know that I would say I disliked it, but it would've been nice to engage more with the game.","I don't see anything wrong at all with SP2's behavior, because they were playing the game by the rules and incentives that were outlined. I was playing the game the exact same way by throwing the ball consistently to the treasurer to increase my monetary incentive, so I can't fault him for doing the same.","I guess I would inquire about their motivation for throwing the ball back and forth to SP2, and rarely including me in the game. I was moreso confused and inquisitive than bothered by it, so I don't think I would have much to express as far as how it affected me.",3
"12","it was unfair. the treasure mostly threw the ball to sp2. i had to wait for a long time before he gave me the ball. i was not satisfied with what how the game went for me..i was clearly cheated. so final answer is, i was not satisfied. thats it ","it was unfair. the treasure mostly threw the ball to sp2. i had to wait for a long time before he gave me the ball. i was not satisfied with what how the game went for me..i was clearly cheated. so final answer is, i was not satisfied. thats it ","it was unfair. the treasure mostly threw the ball to sp2. i had to wait for a long time before he gave me the ball. i was not satisfied with what how the game went for me..i was clearly cheated. so final answer is, i was not satisfied. because of this, i didnt make much money","he was unfair. the treasure mostly threw the ball to sp2. i had to wait for a long time before he gave me the ball. i was not satisfied with what how the game went for me..i was clearly cheated. so final answer is, i was not satisfied. i thought he would go one by one.","i don't think i have an issue with sp2...he was only favored and he was not going to throw it to me for 0 points. it was not his fault. it was all the treasure's fault. but sp2 could have tossed some balls to me so i could toss it to the treasure to ern some points.","it was unfair. the treasure mostly threw the ball to sp2. i had to wait for a long time before he gave me the ball. i was not satisfied with what how the game went for me..i was clearly cheated. so final answer is, i was not satisfied. thats it ",3
